module: unloading 'anaconda/2022.05'
module: loading 'anaconda/3-5.2.0'
module: anaconda: "See https://docs.ccv.brown.edu/oscar/software/anaconda for potential issues on VNC and batch jobs"
module: loading 'cudnn/8.2.0'
module: cudnn: To use: module load cuda/11.1.1 gcc/10.2
module: loading 'cuda/11.1.1'
module: cuda: To use: module load gcc/10.2
module: loading 'gcc/10.2'
module: gcc: "Note: loading the gcc module overrides the gcc version on the system.  If you want to revert to the version of gcc provided by the OS, unload the gcc module."
[32m[I 2023-05-08 22:04:09,986][0m A new study created in memory with name: no-name-02cf8fa7-71d5-4388-8c4a-91cdbd140c8b[0m
[32m[I 2023-05-08 22:19:25,517][0m Trial 0 finished with value: 1.039831259720062 and parameters: {'model_type': 'VAE', 'reconstruction_distribution': 'poisson', 'latent_size': 40, 'num_hidden_layers': 4, 'size of hidden layer 1': 252, 'size of hidden layer 2': 162, 'size of hidden layer 3': 153, 'size of hidden layer 4': 66, 'number_of_warm_up_epochs': 3, 'kl_weight': 0.1715379298112556}. Best is trial 0 with value: 1.039831259720062.[0m
[32m[I 2023-05-08 22:32:27,786][0m Trial 1 finished with value: 0.7835699844479005 and parameters: {'model_type': 'VAE', 'reconstruction_distribution': 'poisson', 'latent_size': 40, 'num_hidden_layers': 3, 'size of hidden layer 1': 97, 'size of hidden layer 2': 268, 'size of hidden layer 3': 110, 'number_of_warm_up_epochs': 5, 'kl_weight': 1.2831998347211253}. Best is trial 1 with value: 0.7835699844479005.[0m
[32m[I 2023-05-08 22:49:45,271][0m Trial 2 finished with value: 0.7949370139968895 and parameters: {'model_type': 'VAE', 'reconstruction_distribution': 'poisson', 'latent_size': 32, 'num_hidden_layers': 5, 'size of hidden layer 1': 270, 'size of hidden layer 2': 159, 'size of hidden layer 3': 162, 'size of hidden layer 4': 170, 'size of hidden layer 5': 177, 'number_of_warm_up_epochs': 5, 'kl_weight': 1.07088749804392}. Best is trial 1 with value: 0.7835699844479005.[0m
[32m[I 2023-05-08 23:02:06,281][0m Trial 3 finished with value: 1.1130614307931572 and parameters: {'model_type': 'VAE', 'reconstruction_distribution': 'poisson', 'latent_size': 38, 'num_hidden_layers': 1, 'size of hidden layer 1': 216, 'number_of_warm_up_epochs': 3, 'kl_weight': 0.6549244713404632}. Best is trial 1 with value: 0.7835699844479005.[0m
[32m[I 2023-05-08 23:18:05,551][0m Trial 4 finished with value: 0.8605101088646967 and parameters: {'model_type': 'VAE', 'reconstruction_distribution': 'poisson', 'latent_size': 22, 'num_hidden_layers': 5, 'size of hidden layer 1': 202, 'size of hidden layer 2': 170, 'size of hidden layer 3': 200, 'size of hidden layer 4': 110, 'size of hidden layer 5': 217, 'number_of_warm_up_epochs': 1, 'kl_weight': 0.2917703600397126}. Best is trial 1 with value: 0.7835699844479005.[0m
[32m[I 2023-05-08 23:34:21,878][0m Trial 5 finished with value: 2.233898133748056 and parameters: {'model_type': 'VAE', 'reconstruction_distribution': 'gaussian', 'latent_size': 15, 'num_hidden_layers': 2, 'size of hidden layer 1': 289, 'size of hidden layer 2': 125, 'number_of_warm_up_epochs': 4, 'kl_weight': 0.28616590930939334}. Best is trial 1 with value: 0.7835699844479005.[0m
[32m[I 2023-05-08 23:47:47,951][0m Trial 6 finished with value: 0.7881096423017108 and parameters: {'model_type': 'VAE', 'reconstruction_distribution': 'poisson', 'latent_size': 42, 'num_hidden_layers': 3, 'size of hidden layer 1': 178, 'size of hidden layer 2': 78, 'size of hidden layer 3': 104, 'number_of_warm_up_epochs': 4, 'kl_weight': 1.501317237948895}. Best is trial 1 with value: 0.7835699844479005.[0m
[32m[I 2023-05-09 00:03:10,509][0m Trial 7 finished with value: 0.7417247278382583 and parameters: {'model_type': 'VAE', 'reconstruction_distribution': 'poisson', 'latent_size': 19, 'num_hidden_layers': 4, 'size of hidden layer 1': 207, 'size of hidden layer 2': 213, 'size of hidden layer 3': 147, 'size of hidden layer 4': 111, 'number_of_warm_up_epochs': 1, 'kl_weight': 1.5529780459111007}. Best is trial 7 with value: 0.7417247278382583.[0m
[32m[I 2023-05-09 00:17:28,595][0m Trial 8 finished with value: 0.8385839813374806 and parameters: {'model_type': 'VAE', 'reconstruction_distribution': 'poisson', 'latent_size': 8, 'num_hidden_layers': 2, 'size of hidden layer 1': 255, 'size of hidden layer 2': 199, 'number_of_warm_up_epochs': 5, 'kl_weight': 0.9196386502818357}. Best is trial 7 with value: 0.7417247278382583.[0m
[32m[I 2023-05-09 00:36:32,479][0m Trial 9 finished with value: 1.8493071539657853 and parameters: {'model_type': 'VAE', 'reconstruction_distribution': 'gaussian', 'latent_size': 55, 'num_hidden_layers': 5, 'size of hidden layer 1': 293, 'size of hidden layer 2': 57, 'size of hidden layer 3': 221, 'size of hidden layer 4': 146, 'size of hidden layer 5': 61, 'number_of_warm_up_epochs': 4, 'kl_weight': 1.1836778436930602}. Best is trial 7 with value: 0.7417247278382583.[0m
[32m[I 2023-05-09 00:52:06,386][0m Trial 10 finished with value: 2.143003888024883 and parameters: {'model_type': 'VAE', 'reconstruction_distribution': 'gaussian', 'latent_size': 25, 'num_hidden_layers': 4, 'size of hidden layer 1': 116, 'size of hidden layer 2': 266, 'size of hidden layer 3': 297, 'size of hidden layer 4': 288, 'number_of_warm_up_epochs': 0, 'kl_weight': 1.866967584565442}. Best is trial 7 with value: 0.7417247278382583.[0m
[32m[I 2023-05-09 01:04:06,027][0m Trial 11 finished with value: 0.9768654743390359 and parameters: {'model_type': 'VAE', 'reconstruction_distribution': 'poisson', 'latent_size': 52, 'num_hidden_layers': 3, 'size of hidden layer 1': 51, 'size of hidden layer 2': 282, 'size of hidden layer 3': 52, 'number_of_warm_up_epochs': 1, 'kl_weight': 1.5570187729130314}. Best is trial 7 with value: 0.7417247278382583.[0m
[32m[I 2023-05-09 01:18:37,699][0m Trial 12 finished with value: 0.7975443234836702 and parameters: {'model_type': 'VAE', 'reconstruction_distribution': 'poisson', 'latent_size': 62, 'num_hidden_layers': 4, 'size of hidden layer 1': 124, 'size of hidden layer 2': 230, 'size of hidden layer 3': 104, 'size of hidden layer 4': 246, 'number_of_warm_up_epochs': 2, 'kl_weight': 1.4364513603512523}. Best is trial 7 with value: 0.7417247278382583.[0m
[32m[I 2023-05-09 01:31:02,997][0m Trial 13 finished with value: 0.8290894245723174 and parameters: {'model_type': 'VAE', 'reconstruction_distribution': 'poisson', 'latent_size': 29, 'num_hidden_layers': 2, 'size of hidden layer 1': 129, 'size of hidden layer 2': 238, 'number_of_warm_up_epochs': 0, 'kl_weight': 1.8123062064222135}. Best is trial 7 with value: 0.7417247278382583.[0m
[32m[I 2023-05-09 01:43:44,617][0m Trial 14 finished with value: 2.7476982892690516 and parameters: {'model_type': 'VAE', 'reconstruction_distribution': 'gaussian', 'latent_size': 48, 'num_hidden_layers': 3, 'size of hidden layer 1': 73, 'size of hidden layer 2': 293, 'size of hidden layer 3': 118, 'number_of_warm_up_epochs': 2, 'kl_weight': 1.3138885179334705}. Best is trial 7 with value: 0.7417247278382583.[0m
[32m[I 2023-05-09 01:57:46,752][0m Trial 15 finished with value: 0.8373872472783825 and parameters: {'model_type': 'VAE', 'reconstruction_distribution': 'poisson', 'latent_size': 20, 'num_hidden_layers': 4, 'size of hidden layer 1': 153, 'size of hidden layer 2': 226, 'size of hidden layer 3': 77, 'size of hidden layer 4': 53, 'number_of_warm_up_epochs': 1, 'kl_weight': 1.9651065925141176}. Best is trial 7 with value: 0.7417247278382583.[0m
[32m[I 2023-05-09 02:08:19,723][0m Trial 16 finished with value: 1.061 and parameters: {'model_type': 'VAE', 'reconstruction_distribution': 'poisson', 'latent_size': 8, 'num_hidden_layers': 1, 'size of hidden layer 1': 84, 'number_of_warm_up_epochs': 2, 'kl_weight': 1.6464359529926271}. Best is trial 7 with value: 0.7417247278382583.[0m
[32m[I 2023-05-09 02:24:53,118][0m Trial 17 finished with value: 0.763398133748056 and parameters: {'model_type': 'VAE', 'reconstruction_distribution': 'poisson', 'latent_size': 45, 'num_hidden_layers': 4, 'size of hidden layer 1': 219, 'size of hidden layer 2': 254, 'size of hidden layer 3': 145, 'size of hidden layer 4': 223, 'number_of_warm_up_epochs': 3, 'kl_weight': 1.2907784917018328}. Best is trial 7 with value: 0.7417247278382583.[0m
[32m[I 2023-05-09 02:43:08,358][0m Trial 18 finished with value: 2.016931570762053 and parameters: {'model_type': 'VAE', 'reconstruction_distribution': 'gaussian', 'latent_size': 47, 'num_hidden_layers': 4, 'size of hidden layer 1': 228, 'size of hidden layer 2': 199, 'size of hidden layer 3': 239, 'size of hidden layer 4': 223, 'number_of_warm_up_epochs': 3, 'kl_weight': 0.9125112104331029}. Best is trial 7 with value: 0.7417247278382583.[0m
[32m[I 2023-05-09 02:59:51,313][0m Trial 19 finished with value: 0.8152029548989115 and parameters: {'model_type': 'VAE', 'reconstruction_distribution': 'poisson', 'latent_size': 31, 'num_hidden_layers': 5, 'size of hidden layer 1': 175, 'size of hidden layer 2': 127, 'size of hidden layer 3': 154, 'size of hidden layer 4': 213, 'size of hidden layer 5': 284, 'number_of_warm_up_epochs': 1, 'kl_weight': 1.7297170434118785}. Best is trial 7 with value: 0.7417247278382583.[0m
[32m[I 2023-05-09 03:15:21,720][0m Trial 20 finished with value: 0.7851049766718506 and parameters: {'model_type': 'VAE', 'reconstruction_distribution': 'poisson', 'latent_size': 64, 'num_hidden_layers': 4, 'size of hidden layer 1': 194, 'size of hidden layer 2': 204, 'size of hidden layer 3': 186, 'size of hidden layer 4': 123, 'number_of_warm_up_epochs': 0, 'kl_weight': 1.6371580787518207}. Best is trial 7 with value: 0.7417247278382583.[0m
[32m[I 2023-05-09 03:30:55,871][0m Trial 21 finished with value: 0.772182737169518 and parameters: {'model_type': 'VAE', 'reconstruction_distribution': 'poisson', 'latent_size': 45, 'num_hidden_layers': 3, 'size of hidden layer 1': 231, 'size of hidden layer 2': 263, 'size of hidden layer 3': 121, 'number_of_warm_up_epochs': 5, 'kl_weight': 1.4134058410576058}. Best is trial 7 with value: 0.7417247278382583.[0m
[32m[I 2023-05-09 03:46:30,211][0m Trial 22 finished with value: 0.8741065318818041 and parameters: {'model_type': 'VAE', 'reconstruction_distribution': 'poisson', 'latent_size': 46, 'num_hidden_layers': 3, 'size of hidden layer 1': 231, 'size of hidden layer 2': 251, 'size of hidden layer 3': 140, 'number_of_warm_up_epochs': 4, 'kl_weight': 1.3884571829280785}. Best is trial 7 with value: 0.7417247278382583.[0m
[32m[I 2023-05-09 04:02:04,788][0m Trial 23 finished with value: 0.8571648522550545 and parameters: {'model_type': 'VAE', 'reconstruction_distribution': 'poisson', 'latent_size': 57, 'num_hidden_layers': 3, 'size of hidden layer 1': 248, 'size of hidden layer 2': 249, 'size of hidden layer 3': 139, 'number_of_warm_up_epochs': 3, 'kl_weight': 1.4757285333808614}. Best is trial 7 with value: 0.7417247278382583.[0m
[32m[I 2023-05-09 04:17:29,036][0m Trial 24 finished with value: 0.8257519440124419 and parameters: {'model_type': 'VAE', 'reconstruction_distribution': 'poisson', 'latent_size': 35, 'num_hidden_layers': 4, 'size of hidden layer 1': 170, 'size of hidden layer 2': 216, 'size of hidden layer 3': 179, 'size of hidden layer 4': 196, 'number_of_warm_up_epochs': 2, 'kl_weight': 1.18141903276043}. Best is trial 7 with value: 0.7417247278382583.[0m
[32m[I 2023-05-09 04:31:37,621][0m Trial 25 finished with value: 0.8603841368584759 and parameters: {'model_type': 'VAE', 'reconstruction_distribution': 'poisson', 'latent_size': 14, 'num_hidden_layers': 2, 'size of hidden layer 1': 205, 'size of hidden layer 2': 294, 'number_of_warm_up_epochs': 5, 'kl_weight': 1.6628663610141792}. Best is trial 7 with value: 0.7417247278382583.[0m
[32m[I 2023-05-09 04:47:56,057][0m Trial 26 finished with value: 0.771300933125972 and parameters: {'model_type': 'VAE', 'reconstruction_distribution': 'poisson', 'latent_size': 44, 'num_hidden_layers': 4, 'size of hidden layer 1': 230, 'size of hidden layer 2': 262, 'size of hidden layer 3': 75, 'size of hidden layer 4': 261, 'number_of_warm_up_epochs': 4, 'kl_weight': 1.3153725576276276}. Best is trial 7 with value: 0.7417247278382583.[0m
[32m[I 2023-05-09 05:06:58,506][0m Trial 27 finished with value: 1.808251166407465 and parameters: {'model_type': 'VAE', 'reconstruction_distribution': 'gaussian', 'latent_size': 36, 'num_hidden_layers': 5, 'size of hidden layer 1': 271, 'size of hidden layer 2': 186, 'size of hidden layer 3': 80, 'size of hidden layer 4': 269, 'size of hidden layer 5': 61, 'number_of_warm_up_epochs': 4, 'kl_weight': 1.2216466913643662}. Best is trial 7 with value: 0.7417247278382583.[0m
[32m[I 2023-05-09 05:22:18,815][0m Trial 28 finished with value: 0.870630637636081 and parameters: {'model_type': 'VAE', 'reconstruction_distribution': 'poisson', 'latent_size': 51, 'num_hidden_layers': 4, 'size of hidden layer 1': 189, 'size of hidden layer 2': 240, 'size of hidden layer 3': 73, 'size of hidden layer 4': 255, 'number_of_warm_up_epochs': 3, 'kl_weight': 1.0849027752459348}. Best is trial 7 with value: 0.7417247278382583.[0m
[32m[I 2023-05-09 05:37:33,272][0m Trial 29 finished with value: 0.7337682737169519 and parameters: {'model_type': 'VAE', 'reconstruction_distribution': 'poisson', 'latent_size': 42, 'num_hidden_layers': 4, 'size of hidden layer 1': 157, 'size of hidden layer 2': 276, 'size of hidden layer 3': 50, 'size of hidden layer 4': 299, 'number_of_warm_up_epochs': 2, 'kl_weight': 1.3440895974609077}. Best is trial 29 with value: 0.7337682737169519.[0m
[32m[I 2023-05-09 05:54:26,122][0m Trial 30 finished with value: 0.7757861586314153 and parameters: {'model_type': 'VAE', 'reconstruction_distribution': 'poisson', 'latent_size': 26, 'num_hidden_layers': 5, 'size of hidden layer 1': 150, 'size of hidden layer 2': 299, 'size of hidden layer 3': 254, 'size of hidden layer 4': 98, 'size of hidden layer 5': 287, 'number_of_warm_up_epochs': 2, 'kl_weight': 1.5629991592111583}. Best is trial 29 with value: 0.7337682737169519.[0m
[32m[I 2023-05-09 06:09:41,373][0m Trial 31 finished with value: 0.7186741835147745 and parameters: {'model_type': 'VAE', 'reconstruction_distribution': 'poisson', 'latent_size': 42, 'num_hidden_layers': 4, 'size of hidden layer 1': 157, 'size of hidden layer 2': 276, 'size of hidden layer 3': 54, 'size of hidden layer 4': 296, 'number_of_warm_up_epochs': 1, 'kl_weight': 1.3311389120122017}. Best is trial 31 with value: 0.7186741835147745.[0m
[32m[I 2023-05-09 06:24:52,037][0m Trial 32 finished with value: 0.7523359253499222 and parameters: {'model_type': 'VAE', 'reconstruction_distribution': 'poisson', 'latent_size': 40, 'num_hidden_layers': 4, 'size of hidden layer 1': 151, 'size of hidden layer 2': 277, 'size of hidden layer 3': 56, 'size of hidden layer 4': 297, 'number_of_warm_up_epochs': 1, 'kl_weight': 1.3458652321824185}. Best is trial 31 with value: 0.7186741835147745.[0m
[32m[I 2023-05-09 06:40:09,425][0m Trial 33 finished with value: 0.819585536547434 and parameters: {'model_type': 'VAE', 'reconstruction_distribution': 'poisson', 'latent_size': 34, 'num_hidden_layers': 4, 'size of hidden layer 1': 149, 'size of hidden layer 2': 278, 'size of hidden layer 3': 53, 'size of hidden layer 4': 298, 'number_of_warm_up_epochs': 1, 'kl_weight': 1.520331264696729}. Best is trial 31 with value: 0.7186741835147745.[0m
[32m[I 2023-05-09 06:56:24,010][0m Trial 34 finished with value: 0.7490536547433905 and parameters: {'model_type': 'VAE', 'reconstruction_distribution': 'poisson', 'latent_size': 40, 'num_hidden_layers': 5, 'size of hidden layer 1': 163, 'size of hidden layer 2': 281, 'size of hidden layer 3': 54, 'size of hidden layer 4': 297, 'size of hidden layer 5': 120, 'number_of_warm_up_epochs': 1, 'kl_weight': 1.3564939374609823}. Best is trial 31 with value: 0.7186741835147745.[0m
[32m[I 2023-05-09 07:12:49,916][0m Trial 35 finished with value: 0.7994440124416796 and parameters: {'model_type': 'VAE', 'reconstruction_distribution': 'poisson', 'latent_size': 38, 'num_hidden_layers': 5, 'size of hidden layer 1': 164, 'size of hidden layer 2': 280, 'size of hidden layer 3': 92, 'size of hidden layer 4': 273, 'size of hidden layer 5': 117, 'number_of_warm_up_epochs': 0, 'kl_weight': 1.0903994412216775}. Best is trial 31 with value: 0.7186741835147745.[0m
[32m[I 2023-05-09 07:28:24,921][0m Trial 36 finished with value: 0.7688141524105755 and parameters: {'model_type': 'VAE', 'reconstruction_distribution': 'poisson', 'latent_size': 40, 'num_hidden_layers': 5, 'size of hidden layer 1': 136, 'size of hidden layer 2': 217, 'size of hidden layer 3': 66, 'size of hidden layer 4': 300, 'size of hidden layer 5': 118, 'number_of_warm_up_epochs': 1, 'kl_weight': 1.4140079376027026}. Best is trial 31 with value: 0.7186741835147745.[0m
[32m[I 2023-05-09 07:43:21,543][0m Trial 37 finished with value: 0.7963926905132193 and parameters: {'model_type': 'VAE', 'reconstruction_distribution': 'poisson', 'latent_size': 30, 'num_hidden_layers': 5, 'size of hidden layer 1': 113, 'size of hidden layer 2': 153, 'size of hidden layer 3': 91, 'size of hidden layer 4': 276, 'size of hidden layer 5': 140, 'number_of_warm_up_epochs': 1, 'kl_weight': 1.7559879794281947}. Best is trial 31 with value: 0.7186741835147745.[0m
[32m[I 2023-05-09 07:59:52,332][0m Trial 38 finished with value: 0.7574836702954898 and parameters: {'model_type': 'VAE', 'reconstruction_distribution': 'poisson', 'latent_size': 42, 'num_hidden_layers': 5, 'size of hidden layer 1': 188, 'size of hidden layer 2': 299, 'size of hidden layer 3': 63, 'size of hidden layer 4': 240, 'size of hidden layer 5': 217, 'number_of_warm_up_epochs': 2, 'kl_weight': 0.9706533655189339}. Best is trial 31 with value: 0.7186741835147745.[0m
[32m[I 2023-05-09 08:16:24,105][0m Trial 39 finished with value: 2.20799533437014 and parameters: {'model_type': 'VAE', 'reconstruction_distribution': 'gaussian', 'latent_size': 18, 'num_hidden_layers': 4, 'size of hidden layer 1': 208, 'size of hidden layer 2': 127, 'size of hidden layer 3': 86, 'size of hidden layer 4': 161, 'number_of_warm_up_epochs': 0, 'kl_weight': 1.220460987372196}. Best is trial 31 with value: 0.7186741835147745.[0m
[32m[I 2023-05-09 08:32:30,060][0m Trial 40 finished with value: 0.7389875583203733 and parameters: {'model_type': 'VAE', 'reconstruction_distribution': 'poisson', 'latent_size': 27, 'num_hidden_layers': 5, 'size of hidden layer 1': 164, 'size of hidden layer 2': 173, 'size of hidden layer 3': 51, 'size of hidden layer 4': 187, 'size of hidden layer 5': 171, 'number_of_warm_up_epochs': 1, 'kl_weight': 0.8271115297414589}. Best is trial 31 with value: 0.7186741835147745.[0m
[32m[I 2023-05-09 08:47:38,975][0m Trial 41 finished with value: 0.7232138413685848 and parameters: {'model_type': 'VAE', 'reconstruction_distribution': 'poisson', 'latent_size': 26, 'num_hidden_layers': 5, 'size of hidden layer 1': 164, 'size of hidden layer 2': 144, 'size of hidden layer 3': 51, 'size of hidden layer 4': 186, 'size of hidden layer 5': 162, 'number_of_warm_up_epochs': 1, 'kl_weight': 0.8596876239694685}. Best is trial 31 with value: 0.7186741835147745.[0m
[32m[I 2023-05-09 09:02:35,248][0m Trial 42 finished with value: 0.748239502332815 and parameters: {'model_type': 'VAE', 'reconstruction_distribution': 'poisson', 'latent_size': 24, 'num_hidden_layers': 5, 'size of hidden layer 1': 136, 'size of hidden layer 2': 141, 'size of hidden layer 3': 66, 'size of hidden layer 4': 190, 'size of hidden layer 5': 184, 'number_of_warm_up_epochs': 1, 'kl_weight': 0.7865806133026494}. Best is trial 31 with value: 0.7186741835147745.[0m
[32m[I 2023-05-09 09:18:49,039][0m Trial 43 finished with value: 0.7477402799377917 and parameters: {'model_type': 'VAE', 'reconstruction_distribution': 'poisson', 'latent_size': 27, 'num_hidden_layers': 5, 'size of hidden layer 1': 181, 'size of hidden layer 2': 108, 'size of hidden layer 3': 98, 'size of hidden layer 4': 136, 'size of hidden layer 5': 226, 'number_of_warm_up_epochs': 2, 'kl_weight': 0.5892157797890526}. Best is trial 31 with value: 0.7186741835147745.[0m
[32m[I 2023-05-09 09:32:44,370][0m Trial 44 finished with value: 0.8404735614307932 and parameters: {'model_type': 'VAE', 'reconstruction_distribution': 'poisson', 'latent_size': 22, 'num_hidden_layers': 4, 'size of hidden layer 1': 109, 'size of hidden layer 2': 172, 'size of hidden layer 3': 116, 'size of hidden layer 4': 74, 'number_of_warm_up_epochs': 1, 'kl_weight': 0.8306619259283472}. Best is trial 31 with value: 0.7186741835147745.[0m
[32m[I 2023-05-09 09:49:13,491][0m Trial 45 finished with value: 0.7314455676516329 and parameters: {'model_type': 'VAE', 'reconstruction_distribution': 'poisson', 'latent_size': 15, 'num_hidden_layers': 5, 'size of hidden layer 1': 161, 'size of hidden layer 2': 185, 'size of hidden layer 3': 51, 'size of hidden layer 4': 194, 'size of hidden layer 5': 155, 'number_of_warm_up_epochs': 0, 'kl_weight': 1.1251801831228931}. Best is trial 31 with value: 0.7186741835147745.[0m
