[32m[I 2023-05-09 10:04:37,645][0m Trial 46 finished with value: 0.803938569206843 and parameters: {'model_type': 'VAE', 'reconstruction_distribution': 'poisson', 'latent_size': 14, 'num_hidden_layers': 5, 'size of hidden layer 1': 140, 'size of hidden layer 2': 106, 'size of hidden layer 3': 66, 'size of hidden layer 4': 187, 'size of hidden layer 5': 156, 'number_of_warm_up_epochs': 0, 'kl_weight': 1.071688500758202}. Best is trial 31 with value: 0.7186741835147745.[0m
/users/srajakum/scratch/Structure_VAE_scRNA_Simulator/Models/scvae/tune.py:366: ExperimentalWarning: plot_param_importances is experimental (supported from v2.2.0). The interface can change in the future.
  param_imp_fig = plot_param_importances(study)
/users/srajakum/scratch/Structure_VAE_scRNA_Simulator/Models/scvae/tune.py:367: ExperimentalWarning: plot_optimization_history is experimental (supported from v2.2.0). The interface can change in the future.
  opt_hist_fig = plot_optimization_history(study)
